{"$id":"https://example.invalid/anki-study-report/core-economy-screening-manifest-v4.schema.json","$schema":"https://json-schema.org/draft/2020-12/schema","additionalProperties":false,"properties":{"$schema":{"const":"../schemas/core-economy-screening-manifest-v4.schema.json"},"artifact_digests":{"additionalProperties":false,"properties":{"matrix":{"const":"6c640a17643ac83c09fe56276072930152baa07f46147ab76c36b7f2b8160f67"},"pipeline":{"const":"f49169b3e91e04e781819bea33b5c86778b981e17a27c954b0ed7295b387af62"},"protocol":{"const":"a6f8faf819e7d4a7c3d5ffd73ad82775642020faa019584b823e20ad3f2b18cd"},"scenarios":{"const":"fabd2cb9934953987cf6b64a6e34d070c3c1d26ef2d4f21641cfe5649cf6443d"}},"required":["protocol","pipeline","scenarios","matrix"],"type":"object"},"environment":{"additionalProperties":false,"properties":{"jsonschema_version":{"minLength":1,"type":"string"},"platform_machine":{"minLength":1,"type":"string"},"platform_system":{"minLength":1,"type":"string"},"python_version":{"minLength":1,"type":"string"}},"required":["python_version","jsonschema_version","platform_system","platform_machine"],"type":"object"},"evaluator":{"additionalProperties":false,"properties":{"hard_gate_compensation":{"const":false},"review_averaging":{"const":"PROHIBITED"},"review_evaluation":{"const":"PARALLEL_SEPARATE"},"seed_policy":{"const":"NONE_DETERMINISTIC_EXACT_MATRIX"},"version":{"const":"core-economy-screening-v4-evaluator-1"},"weighted_overall_score":{"const":false}},"required":["version","seed_policy","weighted_overall_score","hard_gate_compensation","review_evaluation","review_averaging"],"type":"object"},"identity":{"additionalProperties":false,"properties":{"artifact_digest":{"pattern":"^[0-9a-f]{64}$","type":"string"},"artifact_id":{"const":"core-economy-screening-manifest"},"evaluator_version":{"const":"core-economy-screening-v4-evaluator-1"},"status":{"const":"COMPLETE"},"version":{"const":4}},"required":["artifact_id","version","status","artifact_digest","evaluator_version"],"type":"object"},"matrix_accounting":{"additionalProperties":false,"properties":{"actual_rows":{"const":1275},"duplicate_rows":{"const":0},"expected_rows":{"const":1275},"extra_rows":{"const":0},"missing_rows":{"const":0},"unique_rows":{"const":1275}},"required":["expected_rows","actual_rows","unique_rows","missing_rows","extra_rows","duplicate_rows"],"type":"object"},"proofs":{"additionalProperties":false,"properties":{"collection_changed":{"const":false},"due_dates_changed":{"const":false},"fsrs_changed":{"const":false},"learn_limitation":{"const":"DISPOSABLE_ANKI_IDENTITY_PROBE_UNAVAILABLE"},"production_import_boundary":{"const":"PASS"},"production_integration":{"const":false},"real_user_data":{"const":false},"scheduler_changed":{"const":false},"synthetic_only":{"const":true}},"required":["synthetic_only","real_user_data","production_import_boundary","production_integration","scheduler_changed","fsrs_changed","due_dates_changed","collection_changed","learn_limitation"],"type":"object"},"repository":{"additionalProperties":false,"properties":{"base_branch":{"const":"gamification"},"branch":{"const":"chatGPT/G4"},"implementation_commit_timestamp_utc":{"minLength":1,"type":"string"},"implementation_sha":{"pattern":"^[0-9a-f]{40}$","type":"string"},"name":{"const":"AliceLiddell01/anki-study-report"},"publication_sha":{"const":"78ce71d82d72577f8283707a85b8e6b226330c94"}},"required":["name","branch","base_branch","publication_sha","implementation_sha","implementation_commit_timestamp_utc"],"type":"object"}},"required":["$schema","identity","repository","artifact_digests","evaluator","environment","matrix_accounting","proofs"],"type":"object"}
