{"$schema":"../schemas/core-economy-screening-manifest-v4.schema.json","artifact_digests":{"matrix":"6c640a17643ac83c09fe56276072930152baa07f46147ab76c36b7f2b8160f67","pipeline":"f49169b3e91e04e781819bea33b5c86778b981e17a27c954b0ed7295b387af62","protocol":"a6f8faf819e7d4a7c3d5ffd73ad82775642020faa019584b823e20ad3f2b18cd","scenarios":"fabd2cb9934953987cf6b64a6e34d070c3c1d26ef2d4f21641cfe5649cf6443d"},"environment":{"jsonschema_version":"4.26.0","platform_machine":"AMD64","platform_system":"Windows","python_version":"3.11.9"},"evaluator":{"hard_gate_compensation":false,"review_averaging":"PROHIBITED","review_evaluation":"PARALLEL_SEPARATE","seed_policy":"NONE_DETERMINISTIC_EXACT_MATRIX","version":"core-economy-screening-v4-evaluator-1","weighted_overall_score":false},"identity":{"artifact_digest":"585fe8ffd480db71feecd1d188eb3eb4ee4efe464ec2329bf26df56e96656dcf","artifact_id":"core-economy-screening-manifest","evaluator_version":"core-economy-screening-v4-evaluator-1","status":"COMPLETE","version":4},"matrix_accounting":{"actual_rows":1275,"duplicate_rows":0,"expected_rows":1275,"extra_rows":0,"missing_rows":0,"unique_rows":1275},"proofs":{"collection_changed":false,"due_dates_changed":false,"fsrs_changed":false,"learn_limitation":"DISPOSABLE_ANKI_IDENTITY_PROBE_UNAVAILABLE","production_import_boundary":"PASS","production_integration":false,"real_user_data":false,"scheduler_changed":false,"synthetic_only":true},"repository":{"base_branch":"gamification","branch":"chatGPT/G4","implementation_commit_timestamp_utc":"2026-07-29T21:50:08+07:00","implementation_sha":"6174c5deae40b339b7e738ae08c1060b3f0158fa","name":"AliceLiddell01/anki-study-report","publication_sha":"78ce71d82d72577f8283707a85b8e6b226330c94"}}
